ID,Data,texto,sentimento
0,2024-07-01,O Brasil tem demonstrado resiliência econômica frente aos desafios globais.,Positivo
1,2024-07-01,"Investimentos estrangeiros crescem constantemente no país, reforçando a confiança internacional.",Positivo
2,2024-07-01,O agronegócio brasileiro se destaca globalmente pela produtividade e inovação.,Positivo
3,2024-07-01,O setor de energia renovável do Brasil é referência em sustentabilidade.,Positivo
4,2024-07-01,A inovação tecnológica impulsiona o crescimento econômico em diversas regiões brasileiras.,Positivo
5,2024-07-01,Startups brasileiras estão conquistando espaço significativo no cenário global.,Positivo
6,2024-07-01,"O comércio eletrônico cresce aceleradamente, impulsionando pequenos negócios.",Positivo
7,2024-07-01,A estabilidade monetária reforça o ambiente favorável para novos investimentos.,Positivo
8,2024-07-01,O setor industrial brasileiro mostra sinais de recuperação e expansão.,Positivo
9,2024-07-01,O mercado imobiliário tem apresentado crescimento sustentável e sólido.,Positivo
10,2024-07-01,"Empreendedorismo no Brasil está em ascensão, gerando emprego e renda.",Positivo
11,2024-07-01,A exportação de commodities brasileiras atinge níveis históricos positivos.,Positivo
12,2024-07-01,"O país mantém uma sólida reserva internacional, garantindo segurança econômica.",Positivo
13,2024-07-01,Iniciativas de infraestrutura ampliam o potencial econômico das regiões brasileiras.,Positivo
14,2024-07-01,A economia criativa gera oportunidades significativas em diversos estados brasileiros.,Positivo
15,2024-07-01,A crescente inclusão financeira impulsiona novos negócios e serviços no país.,Positivo
16,2024-07-01,O mercado de capitais brasileiro está cada vez mais robusto e atrativo.,Positivo
17,2024-07-01,A diversificação econômica garante maior resistência do Brasil às crises externas.,Positivo
18,2024-07-01,O turismo interno fortalece a economia local em múltiplas regiões.,Positivo
19,2024-07-01,Parcerias público-privadas avançam em projetos estruturantes importantes para o Brasil.,Positivo
20,2024-07-01,Micro e pequenas empresas têm papel crucial na recuperação econômica recente.,Positivo
21,2024-07-01,"O setor de serviços cresce continuamente, ampliando sua participação no PIB.",Positivo
22,2024-07-01,Projetos de infraestrutura logística melhoram o escoamento da produção nacional.,Positivo
23,2024-07-01,A digitalização dos serviços públicos contribui para um ambiente econômico mais eficiente.,Positivo
24,2024-07-01,O Brasil apresenta grandes oportunidades para investimentos no setor tecnológico.,Positivo
25,2024-07-01,A recuperação gradual do mercado de trabalho contribui para o crescimento econômico sustentável.,Positivo
26,2024-07-01,Programas de incentivo fiscal têm estimulado setores estratégicos da economia brasileira.,Positivo
27,2024-07-01,"A confiança do consumidor mostra recuperação, impulsionando o consumo interno.",Positivo
28,2024-07-01,A produção industrial apresenta indicadores positivos de recuperação em vários segmentos.,Positivo
29,2024-07-01,Projetos de infraestrutura energética estão ampliando a capacidade produtiva do país.,Positivo
30,2024-07-01,O crescimento sustentável é uma prioridade cada vez maior nas políticas econômicas brasileiras.,Positivo
31,2024-07-01,O Brasil avança em rankings internacionais de inovação e competitividade econômica.,Positivo
32,2024-07-01,Investimentos em educação e capacitação profissional fortalecem o mercado interno.,Positivo
33,2024-07-01,Setores como saúde e educação têm atraído investimentos significativos recentemente.,Positivo
34,2024-07-01,Reformas econômicas têm facilitado negócios e incentivado novos empreendimentos.,Positivo
35,2024-07-01,A exportação brasileira de produtos industrializados registra crescimento consistente.,Positivo
36,2024-07-01,Iniciativas sustentáveis no agronegócio colocam o Brasil em destaque global.,Positivo
37,2024-07-01,A infraestrutura de telecomunicações brasileira está em constante evolução tecnológica.,Positivo
38,2024-07-01,A indústria automotiva nacional avança na produção de veículos sustentáveis.,Positivo
39,2024-07-01,Programas sociais integrados à economia têm resultados positivos na geração de renda.,Positivo
40,2024-07-01,"A economia circular ganha força no Brasil, incentivando práticas sustentáveis.",Positivo
41,2024-07-01,Parques tecnológicos no Brasil se consolidam como polos de inovação econômica.,Positivo
42,2024-07-01,Iniciativas de desburocratização têm facilitado significativamente o ambiente de negócios.,Positivo
43,2024-07-01,O mercado financeiro brasileiro continua oferecendo estabilidade para investidores.,Positivo
44,2024-07-01,O setor de infraestrutura portuária avança significativamente na ampliação da capacidade produtiva.,Positivo
45,2024-07-01,O aumento das exportações fortalece ainda mais a balança comercial brasileira.,Positivo
46,2024-07-01,Investimentos em pesquisa e desenvolvimento impulsionam a economia brasileira.,Positivo
47,2024-07-01,A geração de energia limpa fortalece a sustentabilidade econômica do país.,Positivo
48,2024-07-01,O Brasil tem consolidado uma posição estratégica no comércio global graças à sua diversidade econômica.,Positivo
49,2024-07-01,"O mercado consumidor brasileiro continua atraindo empresas internacionais, impulsionando a economia interna.",Positivo
50,2024-07-01,O Brasil enfrenta desafios econômicos constantes que impactam o crescimento.,Negativo
51,2024-07-01,Altas taxas de desemprego continuam prejudicando a economia brasileira.,Negativo
52,2024-07-01,A inflação elevada afeta o poder de compra da população brasileira.,Negativo
53,2024-07-01,"O déficit fiscal segue preocupante, limitando investimentos essenciais.",Negativo
54,2024-07-01,A insegurança jurídica dificulta a atração de investimentos estrangeiros.,Negativo
55,2024-07-01,Problemas estruturais na infraestrutura prejudicam o desenvolvimento econômico.,Negativo
56,2024-07-01,O crescimento econômico permanece abaixo das expectativas há anos.,Negativo
57,2024-07-01,Alta carga tributária dificulta o crescimento das empresas no país.,Negativo
58,2024-07-01,O endividamento público preocupa investidores nacionais e estrangeiros.,Negativo
59,2024-07-01,O cenário político instável prejudica o ambiente de negócios brasileiro.,Negativo
60,2024-07-01,Desigualdade econômica crescente afeta o desenvolvimento social do país.,Negativo
61,2024-07-01,Burocracia excessiva dificulta novos negócios e investimentos.,Negativo
62,2024-07-01,Baixo investimento em educação limita a qualificação da força de trabalho brasileira.,Negativo
63,2024-07-01,Corrupção generalizada afeta negativamente a imagem econômica do Brasil.,Negativo
64,2024-07-01,Problemas no sistema de saúde pública geram altos custos sociais e econômicos.,Negativo
65,2024-07-01,O setor industrial brasileiro sofre com falta de competitividade global.,Negativo
66,2024-07-01,Incertezas políticas e econômicas prejudicam investimentos em longo prazo.,Negativo
67,2024-07-01,A desvalorização cambial afeta a estabilidade econômica do país.,Negativo
68,2024-07-01,Elevado índice de informalidade dificulta a arrecadação tributária e o crescimento econômico.,Negativo
69,2024-07-01,Infraestrutura deficiente aumenta os custos logísticos no país.,Negativo
70,2024-07-01,A baixa produtividade dificulta o desenvolvimento econômico sustentável.,Negativo
71,2024-07-01,Instabilidade econômica reduz a confiança dos consumidores brasileiros.,Negativo
72,2024-07-01,Redução dos investimentos públicos impacta negativamente diversos setores da economia.,Negativo
73,2024-07-01,Aumento nos preços dos combustíveis eleva os custos para empresas e consumidores.,Negativo
74,2024-07-01,Desindustrialização prejudica o crescimento sustentável do país.,Negativo
75,2024-07-01,Queda no poder aquisitivo afeta o consumo interno e o comércio.,Negativo
76,2024-07-01,Desafios no mercado imobiliário impedem o crescimento econômico consistente.,Negativo
77,2024-07-01,Políticas econômicas ineficazes dificultam a recuperação rápida da economia.,Negativo
78,2024-07-01,Altas taxas de juros prejudicam o crédito e o crescimento econômico.,Negativo
79,2024-07-01,Problemas ambientais afetam negativamente setores econômicos importantes.,Negativo
80,2024-07-01,Dependência excessiva de commodities torna o país vulnerável a crises internacionais.,Negativo
81,2024-07-01,Baixa inovação tecnológica limita a competitividade das empresas brasileiras.,Negativo
82,2024-07-01,Instabilidade econômica reduz o interesse de investidores internacionais.,Negativo
83,2024-07-01,Crescimento do déficit previdenciário pressiona as contas públicas.,Negativo
84,2024-07-01,O atraso em reformas estruturantes prejudica o desempenho econômico.,Negativo
85,2024-07-01,Dificuldades econômicas têm levado a um aumento da pobreza e desigualdade.,Negativo
86,2024-07-01,Queda na produção industrial reflete desafios persistentes no setor.,Negativo
87,2024-07-01,Setor de serviços sofre impacto direto da redução na renda das famílias brasileiras.,Negativo
88,2024-07-01,O mercado financeiro enfrenta volatilidade constante devido à insegurança econômica.,Negativo
89,2024-07-01,Diminuição dos investimentos em infraestrutura prejudica a competitividade nacional.,Negativo
90,2024-07-01,Aumento da dívida pública compromete investimentos futuros em áreas essenciais.,Negativo
91,2024-07-01,Problemas na gestão econômica afetam negativamente a credibilidade internacional do país.,Negativo
92,2024-07-01,Elevados índices de violência e insegurança impactam diretamente o ambiente de negócios.,Negativo
93,2024-07-01,Baixa eficiência do setor público dificulta o desenvolvimento econômico.,Negativo
94,2024-07-01,Fragilidade econômica expõe o Brasil a constantes riscos financeiros externos.,Negativo
95,2024-07-01,Dificuldades econômicas recentes têm impulsionado o êxodo de talentos para outros países.,Negativo
96,2024-07-01,Redução do investimento estrangeiro direto afeta o desenvolvimento econômico sustentável.,Negativo
97,2024-07-01,A inflação tem corroído o poder de compra da população.,Negativo
98,2024-07-01,O Brasil é uma das maiores economias do mundo em termos de PIB.,Neutro
99,2024-07-01,A economia brasileira é fortemente influenciada por commodities.,Neutro
100,2024-07-01,O mercado interno brasileiro possui grande potencial consumidor.,Neutro
101,2024-07-01,A taxa de juros no Brasil passa por ajustes periódicos.,Neutro
102,2024-07-01,A inflação brasileira oscila conforme políticas econômicas adotadas.,Neutro
103,2024-07-01,O país realiza frequentemente reformas econômicas estruturais.,Neutro
104,2024-07-01,A taxa de câmbio no Brasil apresenta variações constantes.,Neutro
105,2024-07-01,O Banco Central do Brasil define regularmente a taxa Selic.,Neutro
106,2024-07-01,As exportações brasileiras são diversificadas entre produtos agrícolas e industriais.,Neutro
107,2024-07-01,Investidores acompanham de perto o cenário econômico brasileiro.,Neutro
108,2024-07-01,O governo brasileiro frequentemente anuncia pacotes econômicos.,Neutro
109,2024-07-01,O Brasil participa de vários acordos comerciais internacionais.,Neutro
110,2024-07-01,A infraestrutura logística brasileira é ampla e diversificada.,Neutro
111,2024-07-01,Os indicadores econômicos do Brasil são publicados mensalmente.,Neutro
112,2024-07-01,Setores industriais no Brasil enfrentam ciclos de expansão e retração.,Neutro
113,2024-07-01,O mercado de trabalho no Brasil sofre influência direta da economia global.,Neutro
114,2024-07-01,O orçamento público brasileiro é discutido anualmente no Congresso.,Neutro
115,2024-07-01,Diversas agências avaliam regularmente a economia brasileira.,Neutro
116,2024-07-01,O sistema tributário brasileiro é frequentemente revisado.,Neutro
117,2024-07-01,A atividade econômica brasileira é monitorada por órgãos nacionais e internacionais.,Neutro
118,2024-07-01,A dívida pública brasileira é acompanhada por investidores internos e externos.,Neutro
119,2024-07-01,A agricultura desempenha papel central na economia brasileira.,Neutro
120,2024-07-01,O Brasil possui programas de incentivo a micro e pequenas empresas.,Neutro
121,2024-07-01,Mudanças políticas frequentemente impactam as perspectivas econômicas.,Neutro
122,2024-07-01,Empresas brasileiras buscam expandir suas operações internacionalmente.,Neutro
123,2024-07-01,O setor de serviços representa uma parcela significativa do PIB.,Neutro
124,2024-07-01,A taxa de desemprego é divulgada mensalmente pelo IBGE.,Neutro
125,2024-07-01,O mercado financeiro brasileiro possui diversos instrumentos de investimento.,Neutro
126,2024-07-01,Políticas monetárias são usadas regularmente para controle da inflação.,Neutro
127,2024-07-01,O Brasil recebe visitas periódicas de representantes de organismos econômicos internacionais.,Neutro
128,2024-07-01,A Bolsa de Valores brasileira tem volume significativo de negociações diárias.,Neutro
129,2024-07-01,O consumo das famílias é um componente chave da economia brasileira.,Neutro
130,2024-07-01,Empresas multinacionais têm operações importantes no Brasil.,Neutro
131,2024-07-01,O comércio internacional do Brasil inclui uma ampla gama de produtos.,Neutro
132,2024-07-01,As políticas econômicas brasileiras são amplamente discutidas pela mídia.,Neutro
133,2024-07-01,Os investimentos em infraestrutura ocorrem regularmente no país.,Neutro
134,2024-07-01,O governo federal define prioridades econômicas a cada mandato.,Neutro
135,2024-07-01,O setor imobiliário brasileiro é acompanhado de perto por analistas.,Neutro
136,2024-07-01,A população brasileira demonstra diferentes níveis de confiança econômica ao longo do ano.,Neutro
137,2024-07-01,Diversos setores econômicos brasileiros passam por ciclos anuais previsíveis.,Neutro
